{
  "schema_version": 1,
  "id": "recipe.dry_pot",
  "name_de": "Topf trocknen",
  "category": "pottery",
  "tier": "expansion",
  "implementation_status": "defined",
  "knowledge_id": "knowledge.dry_pot",
  "station_id": "station.shelter",
  "inputs": [
    {
      "item_id": "item.pot_wet",
      "quantity": 1.0
    }
  ],
  "tools": [],
  "outputs": [
    {
      "item_id": "item.pot_dry",
      "quantity": 1.0
    }
  ],
  "phases": [
    {
      "id": "work",
      "mode": "active",
      "duration_game_minutes": 5,
      "environment_profile_id": "env.any",
      "on_condition_failure": "block"
    },
    {
      "id": "process",
      "mode": "passive",
      "duration_game_minutes": 2880,
      "environment_profile_id": "env.dry",
      "on_condition_failure": "pause",
      "max_blocked_game_minutes": 5760
    }
  ],
  "failure_output_policy": "spoiled_workpiece",
  "balance_status": "draft",
  "notes_de": "Mengen, Ausbeuten und Zeiten sind vorläufige Spielwerte; fachlich und spielerisch zu prüfen."
}
