{
  "schema_version": 1,
  "id": "recipe.carve_pegs",
  "name_de": "Holzdübel schnitzen",
  "category": "wood",
  "tier": "expansion",
  "implementation_status": "defined",
  "knowledge_id": "knowledge.carve_pegs",
  "station_id": "station.hand",
  "inputs": [
    {
      "item_id": "item.branch",
      "quantity": 1.0
    }
  ],
  "tools": [
    {
      "capability": "cutting",
      "minimum_condition": 0.2,
      "wear_per_batch": 0.01
    }
  ],
  "outputs": [
    {
      "item_id": "item.peg",
      "quantity": 8.0
    }
  ],
  "phases": [
    {
      "id": "work",
      "mode": "active",
      "duration_game_minutes": 30,
      "environment_profile_id": "env.any",
      "on_condition_failure": "block"
    }
  ],
  "failure_output_policy": "spoiled_workpiece",
  "balance_status": "draft",
  "notes_de": "Mengen, Ausbeuten und Zeiten sind vorläufige Spielwerte; fachlich und spielerisch zu prüfen."
}
