{
  "schema_version": 1,
  "id": "recipe.dress_flax",
  "name_de": "Flachs brechen und hecheln",
  "category": "fibers",
  "tier": "expansion",
  "implementation_status": "defined",
  "knowledge_id": "knowledge.dress_flax",
  "station_id": "station.workbench",
  "inputs": [
    {
      "item_id": "item.flax_retted",
      "quantity": 2.5
    }
  ],
  "tools": [],
  "outputs": [
    {
      "item_id": "item.flax_fiber",
      "quantity": 0.6
    }
  ],
  "phases": [
    {
      "id": "work",
      "mode": "active",
      "duration_game_minutes": 120,
      "environment_profile_id": "env.any",
      "on_condition_failure": "block"
    }
  ],
  "failure_output_policy": "spoiled_workpiece",
  "balance_status": "draft",
  "notes_de": "Mengen, Ausbeuten und Zeiten sind vorläufige Spielwerte; fachlich und spielerisch zu prüfen."
}
