{
  "schema_version": 1,
  "id": "recipe.bake_flatbread",
  "name_de": "Fladenbrot backen",
  "category": "food",
  "tier": "expansion",
  "implementation_status": "defined",
  "knowledge_id": "knowledge.bake_flatbread",
  "station_id": "station.hearth",
  "inputs": [
    {
      "item_id": "item.dough",
      "quantity": 1.62
    },
    {
      "item_id": "item.firewood",
      "quantity": 0.7
    }
  ],
  "tools": [],
  "outputs": [
    {
      "item_id": "item.flatbread",
      "quantity": 1.35
    }
  ],
  "phases": [
    {
      "id": "work",
      "mode": "active",
      "duration_game_minutes": 25,
      "environment_profile_id": "env.any",
      "on_condition_failure": "block"
    },
    {
      "id": "process",
      "mode": "passive",
      "duration_game_minutes": 15,
      "environment_profile_id": "env.cooking",
      "on_condition_failure": "pause",
      "max_blocked_game_minutes": 30
    }
  ],
  "failure_output_policy": "spoiled_workpiece",
  "balance_status": "draft",
  "notes_de": "Mengen, Ausbeuten und Zeiten sind vorläufige Spielwerte; fachlich und spielerisch zu prüfen."
}
