{
  "schema_version": 1,
  "id": "recipe.haft_stone_axe",
  "name_de": "Steinaxt schäften",
  "category": "tools",
  "tier": "expansion",
  "implementation_status": "defined",
  "knowledge_id": "knowledge.haft_stone_axe",
  "station_id": "station.hand",
  "inputs": [
    {
      "item_id": "item.stone_axe_head",
      "quantity": 1.0
    },
    {
      "item_id": "item.handle",
      "quantity": 1.0
    },
    {
      "item_id": "item.cord",
      "quantity": 2.0
    }
  ],
  "tools": [],
  "outputs": [
    {
      "item_id": "item.stone_axe",
      "quantity": 1.0
    }
  ],
  "phases": [
    {
      "id": "work",
      "mode": "active",
      "duration_game_minutes": 35,
      "environment_profile_id": "env.any",
      "on_condition_failure": "block"
    }
  ],
  "failure_output_policy": "spoiled_workpiece",
  "balance_status": "draft",
  "notes_de": "Mengen, Ausbeuten und Zeiten sind vorläufige Spielwerte; fachlich und spielerisch zu prüfen."
}
