{
  "schema_version": 1,
  "id": "recipe.fire_pot",
  "name_de": "Topf brennen",
  "category": "pottery",
  "tier": "expansion",
  "implementation_status": "defined",
  "knowledge_id": "knowledge.fire_pot",
  "station_id": "station.pottery_kiln",
  "inputs": [
    {
      "item_id": "item.pot_dry",
      "quantity": 1.0
    },
    {
      "item_id": "item.firewood",
      "quantity": 6.0
    }
  ],
  "tools": [],
  "outputs": [
    {
      "item_id": "item.pot",
      "quantity": 1.0
    }
  ],
  "phases": [
    {
      "id": "work",
      "mode": "active",
      "duration_game_minutes": 60,
      "environment_profile_id": "env.any",
      "on_condition_failure": "block"
    },
    {
      "id": "process",
      "mode": "passive",
      "duration_game_minutes": 360,
      "environment_profile_id": "env.kiln_hot",
      "on_condition_failure": "pause",
      "max_blocked_game_minutes": 720
    }
  ],
  "failure_output_policy": "spoiled_workpiece",
  "balance_status": "draft",
  "notes_de": "Vereinfachter Brennverlauf; Aufheizen und Abkühlen später getrennt. Ofenwärme und Brennstoff müssen tatsächlich bereitstehen."
}
