{
  "schema_version": 1,
  "id": "recipe.boil_water",
  "name_de": "Wasser abkochen",
  "category": "food",
  "tier": "prototype",
  "implementation_status": "defined",
  "knowledge_id": "knowledge.boil_water",
  "station_id": "station.hearth",
  "inputs": [
    {
      "item_id": "item.water_raw",
      "quantity": 2.0
    },
    {
      "item_id": "item.firewood",
      "quantity": 0.3
    }
  ],
  "tools": [
    {
      "capability": "cooking_vessel",
      "minimum_condition": 0.2,
      "wear_per_batch": 0.01
    }
  ],
  "outputs": [
    {
      "item_id": "item.water_safe",
      "quantity": 1.8
    }
  ],
  "phases": [
    {
      "id": "work",
      "mode": "active",
      "duration_game_minutes": 10,
      "environment_profile_id": "env.any",
      "on_condition_failure": "block"
    },
    {
      "id": "process",
      "mode": "passive",
      "duration_game_minutes": 10,
      "environment_profile_id": "env.boiling",
      "on_condition_failure": "pause",
      "max_blocked_game_minutes": 20
    }
  ],
  "failure_output_policy": "spoiled_workpiece",
  "balance_status": "draft",
  "notes_de": "Vereinfachte Spielregel gegen biologische Belastung; chemische Verunreinigungen werden nicht entfernt."
}
