{
  "schema_version": 1,
  "id": "recipe.dry_tinder",
  "name_de": "Rinde zu Zunder aufbereiten und trocknen",
  "category": "wood",
  "tier": "prototype",
  "implementation_status": "defined",
  "knowledge_id": "knowledge.dry_tinder",
  "station_id": "station.shelter",
  "inputs": [
    {
      "item_id": "item.bark",
      "quantity": 0.2
    }
  ],
  "tools": [],
  "outputs": [
    {
      "item_id": "item.tinder",
      "quantity": 0.1
    }
  ],
  "phases": [
    {
      "id": "work",
      "mode": "active",
      "duration_game_minutes": 10,
      "environment_profile_id": "env.any",
      "on_condition_failure": "block"
    },
    {
      "id": "process",
      "mode": "passive",
      "duration_game_minutes": 720,
      "environment_profile_id": "env.dry",
      "on_condition_failure": "pause",
      "max_blocked_game_minutes": 1440
    }
  ],
  "failure_output_policy": "spoiled_workpiece",
  "balance_status": "draft",
  "notes_de": "Mengen, Ausbeuten und Zeiten sind vorläufige Spielwerte; fachlich und spielerisch zu prüfen."
}
