{
  "schema_version": 1,
  "id": "recipe.carve_handle",
  "name_de": "Werkzeugstiel schnitzen",
  "category": "wood",
  "tier": "prototype",
  "implementation_status": "defined",
  "knowledge_id": "knowledge.carve_handle",
  "station_id": "station.hand",
  "inputs": [
    {
      "item_id": "item.branch",
      "quantity": 1.0
    }
  ],
  "tools": [
    {
      "capability": "cutting",
      "minimum_condition": 0.2,
      "wear_per_batch": 0.01
    }
  ],
  "outputs": [
    {
      "item_id": "item.handle",
      "quantity": 1.0
    }
  ],
  "phases": [
    {
      "id": "work",
      "mode": "active",
      "duration_game_minutes": 35,
      "environment_profile_id": "env.any",
      "on_condition_failure": "block"
    }
  ],
  "failure_output_policy": "spoiled_workpiece",
  "balance_status": "draft",
  "notes_de": "Mengen, Ausbeuten und Zeiten sind vorläufige Spielwerte; fachlich und spielerisch zu prüfen."
}
