{
  "schema_version": 1,
  "id": "recipe.cook_stew",
  "name_de": "Eintopf kochen",
  "category": "food",
  "tier": "expansion",
  "implementation_status": "defined",
  "knowledge_id": "knowledge.cook_stew",
  "station_id": "station.hearth",
  "inputs": [
    {
      "item_id": "item.meat_raw",
      "quantity": 0.3
    },
    {
      "item_id": "item.mushrooms",
      "quantity": 0.2
    },
    {
      "item_id": "item.water_safe",
      "quantity": 1.0
    },
    {
      "item_id": "item.firewood",
      "quantity": 0.6
    }
  ],
  "tools": [
    {
      "capability": "cooking_vessel",
      "minimum_condition": 0.2,
      "wear_per_batch": 0.01
    }
  ],
  "outputs": [
    {
      "item_id": "item.stew",
      "quantity": 1.25
    }
  ],
  "phases": [
    {
      "id": "work",
      "mode": "active",
      "duration_game_minutes": 25,
      "environment_profile_id": "env.any",
      "on_condition_failure": "block"
    },
    {
      "id": "process",
      "mode": "passive",
      "duration_game_minutes": 45,
      "environment_profile_id": "env.cooking",
      "on_condition_failure": "pause",
      "max_blocked_game_minutes": 90
    }
  ],
  "failure_output_policy": "spoiled_workpiece",
  "balance_status": "draft",
  "notes_de": "Mengen, Ausbeuten und Zeiten sind vorläufige Spielwerte; fachlich und spielerisch zu prüfen."
}
