{
  "schema_version": 1,
  "id": "recipe.mix_mead",
  "name_de": "Metansatz mischen",
  "category": "brewing",
  "tier": "expansion",
  "implementation_status": "defined",
  "knowledge_id": "knowledge.mix_mead",
  "station_id": "station.hand",
  "inputs": [
    {
      "item_id": "item.honey",
      "quantity": 1.5
    },
    {
      "item_id": "item.water_safe",
      "quantity": 5.0
    }
  ],
  "tools": [
    {
      "capability": "fermentation_vessel",
      "minimum_condition": 0.2,
      "wear_per_batch": 0.01
    }
  ],
  "outputs": [
    {
      "item_id": "item.mead_must",
      "quantity": 6.0
    }
  ],
  "phases": [
    {
      "id": "work",
      "mode": "active",
      "duration_game_minutes": 20,
      "environment_profile_id": "env.any",
      "on_condition_failure": "block"
    }
  ],
  "failure_output_policy": "spoiled_workpiece",
  "balance_status": "draft",
  "notes_de": "Mengen, Ausbeuten und Zeiten sind vorläufige Spielwerte; fachlich und spielerisch zu prüfen."
}
