{
  "schema_version": 1,
  "id": "recipe.weave_basket",
  "name_de": "Korb flechten",
  "category": "fibers",
  "tier": "expansion",
  "implementation_status": "defined",
  "knowledge_id": "knowledge.weave_basket",
  "station_id": "station.hand",
  "inputs": [
    {
      "item_id": "item.branch",
      "quantity": 12.0
    },
    {
      "item_id": "item.cord",
      "quantity": 2.0
    }
  ],
  "tools": [
    {
      "capability": "cutting",
      "minimum_condition": 0.2,
      "wear_per_batch": 0.01
    }
  ],
  "outputs": [
    {
      "item_id": "item.basket",
      "quantity": 1.0
    }
  ],
  "phases": [
    {
      "id": "work",
      "mode": "active",
      "duration_game_minutes": 180,
      "environment_profile_id": "env.any",
      "on_condition_failure": "block"
    }
  ],
  "failure_output_policy": "spoiled_workpiece",
  "balance_status": "draft",
  "notes_de": "Äste müssen als biegsame Ruten geeignet sein; Eignungsfilter ist eine geplante Erweiterung des Itemvertrags. Bis dahin nur kuratierte Szenario-Ruten verwenden."
}
