{
  "schema_version": 1,
  "id": "recipe.sew_tunic",
  "name_de": "Tunika nähen",
  "category": "fibers",
  "tier": "expansion",
  "implementation_status": "defined",
  "knowledge_id": "knowledge.sew_tunic",
  "station_id": "station.hand",
  "inputs": [
    {
      "item_id": "item.linen_cloth",
      "quantity": 2.0
    },
    {
      "item_id": "item.linen_yarn",
      "quantity": 10.0
    }
  ],
  "tools": [
    {
      "capability": "cutting",
      "minimum_condition": 0.2,
      "wear_per_batch": 0.01
    },
    {
      "capability": "sewing",
      "minimum_condition": 0.2,
      "wear_per_batch": 0.01
    }
  ],
  "outputs": [
    {
      "item_id": "item.tunic",
      "quantity": 1.0
    }
  ],
  "phases": [
    {
      "id": "work",
      "mode": "active",
      "duration_game_minutes": 180,
      "environment_profile_id": "env.any",
      "on_condition_failure": "block"
    }
  ],
  "failure_output_policy": "spoiled_workpiece",
  "balance_status": "draft",
  "notes_de": "Mengen, Ausbeuten und Zeiten sind vorläufige Spielwerte; fachlich und spielerisch zu prüfen."
}
