{
  "schema_version": 1,
  "id": "recipe.forge_axe_head",
  "name_de": "Eisenaxtkopf schmieden",
  "category": "metal",
  "tier": "expansion",
  "implementation_status": "defined",
  "knowledge_id": "knowledge.forge_axe_head",
  "station_id": "station.forge",
  "inputs": [
    {
      "item_id": "item.wrought_iron",
      "quantity": 1.0
    },
    {
      "item_id": "item.charcoal",
      "quantity": 2.0
    }
  ],
  "tools": [
    {
      "capability": "smithing",
      "minimum_condition": 0.2,
      "wear_per_batch": 0.01
    },
    {
      "capability": "hot_grip",
      "minimum_condition": 0.2,
      "wear_per_batch": 0.01
    }
  ],
  "outputs": [
    {
      "item_id": "item.iron_axe_head",
      "quantity": 1.0
    }
  ],
  "phases": [
    {
      "id": "work",
      "mode": "active",
      "duration_game_minutes": 180,
      "environment_profile_id": "env.any",
      "on_condition_failure": "block"
    }
  ],
  "failure_output_policy": "spoiled_workpiece",
  "balance_status": "draft",
  "notes_de": "Mengen, Ausbeuten und Zeiten sind vorläufige Spielwerte; fachlich und spielerisch zu prüfen."
}
