{
  "schema_version": 1,
  "id": "recipe.ret_flax",
  "name_de": "Flachs rösten",
  "category": "fibers",
  "tier": "expansion",
  "implementation_status": "defined",
  "knowledge_id": "knowledge.ret_flax",
  "station_id": "station.vat",
  "inputs": [
    {
      "item_id": "item.flax_straw",
      "quantity": 3.0
    },
    {
      "item_id": "item.water_raw",
      "quantity": 10.0
    }
  ],
  "tools": [],
  "outputs": [
    {
      "item_id": "item.flax_retted",
      "quantity": 2.5
    }
  ],
  "phases": [
    {
      "id": "work",
      "mode": "active",
      "duration_game_minutes": 45,
      "environment_profile_id": "env.any",
      "on_condition_failure": "block"
    },
    {
      "id": "process",
      "mode": "passive",
      "duration_game_minutes": 10080,
      "environment_profile_id": "env.tanning",
      "on_condition_failure": "pause",
      "max_blocked_game_minutes": 20160
    }
  ],
  "failure_output_policy": "spoiled_workpiece",
  "balance_status": "draft",
  "notes_de": "Rösten bedeutet hier mikrobieller Faseraufschluss, nicht Erhitzen. Verunreinigtes Prozesswasser später gesondert bilanzieren."
}
