{
  "schema_version": 1,
  "id": "recipe.grind_flour",
  "name_de": "Getreide mahlen",
  "category": "food",
  "tier": "expansion",
  "implementation_status": "defined",
  "knowledge_id": "knowledge.grind_flour",
  "station_id": "station.hand",
  "inputs": [
    {
      "item_id": "item.wheat",
      "quantity": 1.0
    }
  ],
  "tools": [
    {
      "capability": "grinding",
      "minimum_condition": 0.2,
      "wear_per_batch": 0.01
    }
  ],
  "outputs": [
    {
      "item_id": "item.flour",
      "quantity": 0.85
    }
  ],
  "phases": [
    {
      "id": "work",
      "mode": "active",
      "duration_game_minutes": 45,
      "environment_profile_id": "env.any",
      "on_condition_failure": "block"
    }
  ],
  "failure_output_policy": "spoiled_workpiece",
  "balance_status": "draft",
  "notes_de": "Mengen, Ausbeuten und Zeiten sind vorläufige Spielwerte; fachlich und spielerisch zu prüfen."
}
